31,Nanchang University: Announcement of Nanchang University on Open Recruitment of Deans of Schools and Affiliates,"China, Nanchang | Nanchang University ","Nanchang University (NCU) is located in Nanchang, a famous historical and cultural city, which is the capital of Jiangxi Province, an eastern part of China. It is a comprehensive university that is listed in the national “Double First-Class” Initiative of China and co-constructed by the Chinese Ministry of Education and Jiangxi Province. NCU consists of five faculties, namely Humanities, Social Sciences, Science & Technology (Division I), Science & Technology (Division II) and Medicine, and contains 5 affiliated hospitals, and 9 national clinical key specialist disciplines. NCU encompasses 132 undergraduate majors categorized within 12 disciplines, 51 academic master’s degrees programs, 31 specialty master’s degrees programs, 22 academic doctor degrees programs, 3 specialty doctor degrees programs, and 11 postdoctoral scientific research stations. Twelve subjects are among the top 1% of ESI ranking in the world, among which the Agricultural Science (mainly Food Science) is at the top 0.6%. In the new era, the Jiangxi Province Governments have decided to “invest all provincial efforts to construct Nanchang University along the direction of the world-class universities”. On the basis of cultivating virtues and talents, Nanchang University has actively implemented the strategy to build up a research-intensive university featured by innovation and integration of education, research and industry, all of which are strengthened by talented scholars. While staying realistic and pragmatic, the leadership forges ahead in an innovative and enterprising spirit and strives to build a world-class university with “Jiangxi-grounded Chinese characteristics”. All outstanding talents are warmly welcome to join Nanchang University to contribute yours wisdoms, realize your dreams and seek common development! I. Recruitment Positions Deans of 6 schools: School of Journalism and Communication, School of Advanced Manufacturing, School of Information Engineering, School of Life Sciences, School of Basic Medical Sciences and School of Pharmaceutical Sciences. Dean of 1 affiliate: Jiangxi Academy of Medical Sciences. II. Requirements for Candidates 1. Abide by the Constitution and laws of the People’s Republic of China, execute the fundamental task of cultivating virtues and talent, and exhibit full passion on higher education. 2. Strong publication records and influential achievements in research that are recognized by international peers and excellent leadership in relevant fields. 3. Strong leadership, teamwork spirit and dedication, and strategic vision on the development of the related school in research and education which can lead to internationally advanced levels. 4. Full-time position III. Mode of Appointment The term of the first appointment is 4 years ; appointment may be renewed if passing the assessment upon expiration of the term. IV. Salary, Benefits and Start-up Package The salary and benefits are generous and negotiable upon different qualifications. Start-up package is competitive. V. Position Description 1. Take charge of the overall administrative work of the school (unit). Plan and work out the overall developmental goals of the school (unit) in compliance with the university objective of creating a world-class university and disciplines and assure and promote implementation of various reform and developmental tasks. 2. Recruit and cultivate high levels of faculty members and outstanding young talents for the school (unit); lead and establish high level teams of faculty full of creativity with competitiveness, influence and moving up spirit. 3. Make strategic decision on the direction of research, adjust discipline structure, strengthen research and innovation capabilities of the school (unit), and organize the application for state-level key and major project grants; incubate and form major platforms for team achievements; facilitate research collaboration between industries and the university; serve the needs of national strategy and regional socioeconomic development. 4. Promote the school’s teaching reform by focusing on the essential task of cultivating virtues and talents and considering the cultivation features of innovative and entrepreneurial talents; strengthen the construction of world-class majors and disciplines, improve talent cultivation system and improve talent cultivation quality comprehensively. 5. Establish long-term stable strategic cooperation with the world’s renowned academic institutions on education and research, promote high-level international exchange and cooperation, improve globalization, and enhance global competitiveness of the school (unit). 6. Finish other working assignments specified in employment contract. VI. Documents to Be Provided by Applicants 1. Curriculum Vitae. 2. Summary of achievements (including 5 most representative publications). 3. Research proposal and teaching and administrative work plans (including thoughts, objectives and measures of boosting the high-quality development of the school and disciplines). 4. Arrange three letters of recommendation directly sent to the Human Resources Department of Nanchang University. All applicants shall make application based on the principles of integrity and commitment and warrant the accuracy and validity of the information they provide. Whoever provides any false materials will be disqualified upon discovery. VII. Application Deadline From the date of the announcement to June 30, 2023 . VIII. Application Process 1. Qualification review. The university will appraise applicants’ qualifications in order to determine those eligible for an interview. 2. Interview. The university will conduct interviews online (overseas talent) or offline in order to determine the applications included in the next stage of investigation. 3. Employment. After decision made on the applicants, the university will issue an employment contract with appointees and procced through the relevant employment procedures. IX. Contacts Address: Human Resources Office of Nanchang University at 999 Xuefu Avenue, Nanchang City Postal Code: 330031 Contact: Mr. Jin-Sheng Cao, Mr. Yu-Guang Yang Tel: 0791-83969050, 83969074 Email: zzb@ncu.edu.cn The university will keep confidential all invited applicants coming to the site, provide board and lodging for candidates and reimburse domestic or international flight fares.",2023-05-29 10:00:12,2023-07-10 22:59:00,,"China, Nanchang",Nanchang University,https://www.nature.com/naturecareers/job/12799181/announcement-of-nanchang-university-on-open-recruitment-of-deans-of-schools-and-affiliates/?TrackID=12&utm_source=rss&utm_medium=feed&utm_campaign=general,0,0,0,0,0,0,0,0,0,1,0,0,0,0,0,0,896,5,15
32,Baylor College of Medicine (BCM): Research Associate - Mass Spectrometry,"United States, Houston | Baylor College of Medicine (BCM) ","Summary The Division of Surgical Oncology has an open position for an enthusiastic Research Associate (PhD) to join the research group of Prof. Livia Schiavinato Eberlin. The research associate will be involved in research developing and applying mass spectrometry technologies to clinical and cancer research. The research associate will be expected to manage research projects involving clinical studies and collaborations at the Texas medical center. The research associate is expected to design and perform experiments using mass spectrometry and mass spectrometry imaging techniques. This position involves day to day research activities, including data collection, data evaluation, documentation, organization, and scientific writing. The research associate is also expected to supervise other research staff including postdoctoral fellows and graduate research assistants. Job Duties Plan, direct and conduct advanced research experiments using mass spectrometry. Evaluate and analyze mass spectrometry data. Perform statistical analysis. Establish new research protocols and procedures. Summarize research findings and publish results in research journals. Assist with grant proposal writing and progress reports. Assist with laboratory operations. Support supervision of research staff including postdoctoral fellows and graduate students. Assist the principal investigator in maintaining and conducting research activities in the laboratory. Work in research projects involving the use of mass spectrometry and mass spectrometry imaging in biomedical and cancer research. Perform experiments using mass spectrometry instrumentation, as well as data and statistical analysis. Lead clinical studies and participate in research involving human subjects. Interact directly with clinicians, surgeons, and pathologists to fulfill the aims of the research projects. Minimum Qualifications Master's degree in Basic Science or a related field. Experience in lieu of degree will not be accepted. Three years of relevant experience typically as a Research Assistant, Research Technician or Postdoctoral Fellow/Associate. Preferred Qualifications Ph.D. in Chemistry, Basic Science, Health Science, or a related field. Postdoctoral experience in mass spectrometry applied to clinical research. Experience with ambient ionization mass spectrometry and/or mass spectrometry imaging is desirable. Baylor College of Medicine requires employees to be fully vaccinated -subject to approved exemptions-against vaccine-preventable diseases including, but not limited to, COVID-19 and influenza. Baylor College of Medicine is an Equal Opportunity/Affirmative Action/Equal Access Employer.",2023-05-29 10:00:13,2023-07-09 22:59:00,,"United States, Houston",Baylor College of Medicine (BCM),https://www.nature.com/naturecareers/job/12799159/research-associate-mass-spectrometry/?TrackID=12&utm_source=rss&utm_medium=feed&utm_campaign=general,0,0,0,0,0,0,0,0,0,1,0,0,0,0,0,0,352,9,10
33,"University of Gothenburg, Institute of Biomedicine: Postdoctoral fellow in Bioinformatics and Antibiotic resistance","Sweden, Gothenburg | University of Gothenburg, Institute of Biomedicine ","We seek a PhD for a full time postdoctoral position (24 months) within the research group led by Professor Joakim Larsson, Department of Infectious Diseases, Institute for Biomedicine, Sahlgrenska academy at the University of Gothenburg, Sweden. The focus of the research group is on antibiotic resistance development, particularly the role of the external environment. The group consists of 1 professor, 1 associate professor, 7 postdoctoral fellows, 1 PhD students, 2 biologists/research assistants as well as master students. ( https://www.gu.se/en/biomedicine/about-us/department-of-infectious-diseases/joakim-larsson-group ). Larsson also leads the Centre of Antibiotic Resistance Research in Gothenburg (CARe; www.gu.se/en/care ) with ca 150 researchers. The group has extensive collaboration with other universities, nationally and internationally, not the least with the group of Professor Erik Kristiansson at Chalmers. The research is interdisciplinary and has significant funding through e.g. the Swedish Research Councils VR and Formas. Subject area Bioinformatics and antibiotic resistance Subject area description Most of the resistance genes that cause problems in the clinic today seem to originate from harmless, environmental bacteria. Our group studies the driving forces behind this development, particularly the effects of low levels of antibiotics and antibacterial biocides in wastewaters from hospitals, municipalities and industries (see Larsson’s website). In some sub-projects, we study the evolutionary relationship between resistance genes in environmental bacteria and pathogens, and search for new forms of resistance in different environments using both bioinformatic methods as well different large-scale functional screens. We also study how analyses of resistant bacteria in sewage can inform predictions of the local, clinical resistance situation. A better knowledge about all these processes and drives will be valuable to be assess and respond to threats to our health. We are now looking for a postdoctoral fellow who is interested in taking on the task to experimentally explore the environmental dimensions of antibiotic resistance. Duties Depending on the applicant’s background, he/she is expected to conduct experimental research, addressing one or several of the research areas mentioned above. This could for example include analyses of DNA-sequences, both from large-scale DNA sequencing efforts of metagenomes and bacterial genomes, phylogeny and biostatistical analyses. Proficiency in programming (Python or equivalent) as well as work in a Linux/UNIX-environment is a must. Prior experience of machine learning and managing large amounts of data and/or databases are considered merits. Within the group there is already competence within e.g. bioinformatics, microbiology, molecular biology and environmental sciences, and we collaborate closely with clinicians, analytical chemists as well as with scientists outside the natural science domain. The work is expected to be conducted in collaboration; hence complementary expertise is valuable. The work also includes authoring/co-authoring scientific publications and presenting research at international scientific conferences Eligibility The eligibility criteria for employing teaching staff are set out in Chapter 4 of the Higher Education Ordinance and in the Appointment Procedure for Teaching Posts at the University of Gothenburg. To be eligible for appointment as a postdoc, the applicant is required to have a doctoral degree, a doctoral degree in art or a foreign degree that is deemed to be equivalent to a doctoral degree. This eligibility requirement must be met before the employment decision is made. In the first instance, those who have completed their degree no more than three years prior to the end of the application period shall be considered. Those who have completed their degree more than three years prior to the end of the application period may also be considered in the first instance if special grounds exist. Special grounds relate to leave of absence due to illness, parental leave, commissions of trust within union organisations, service within the defence services or other similar circumstances, as well as clinical service or service/assignment relevant to the subject area. Assessment criteria PhD in relevant area, as well as excellent scientific production in relation to the time passed since completing PhD are required. A high degree of independence including extensive experience of bioinformatic work with several of the approaches indicated above, experience from relevant research on antibiotic resistance, previous international postdoc experience, excellent communicative skills particularly regarding verbal and written scientific English, a developed way of critical thinking, experience from working at different labs and an ability to work successfully in a group are all additional qualifying criteria. Regulations for the evaluation of qualifications for academic positions are given in Chapter 4, Section 3 - 4 of the Higher Education Ordinance. Employment The employment is full time and temporary, two years with the possibility of one year's extension, with placement at the Institute of Biomedicine. First day of employment as agreed. Selection process How to apply: https://www.gu.se/en/work-at-the-university-of-gothenburg/how-to-apply Contact information If you have any questions about the position, please contact Joakim Larsson, Professor. E-mail: joakim.larsson@fysiologi.gu.se Unions Union representatives at the University of Gothenburg can be found here: https://www.gu.se/om-universitetet/jobba-hos-oss/hjalp-for-sokande Application Submit your application via the University of Gothenburg’s recruitment portal by clicking the “Apply” button. It is your responsibility to ensure that the application is complete as per the vacancy notice, and that the University receives it by the final application deadline. The application should contain: A cover letter giving a brief description of previous research experience, and a motivation to why you are applying A CV including a list of publications Proof of completed PhD Contact details of two references Applications must be received by: 2023-06-07. Information for International Applicants Choosing a career in a foreign country is a big step. Thus, to give you a general idea of what we and Gothenburg have to offer in terms of benefits and life in general for you and your family/spouse/partner please visit: https://www.gu.se/en/about-the-university/welcome-services https://www.movetogothenburg.com/",2023-05-29 10:00:13,2023-06-07 22:59:00,,"Sweden, Gothenburg","University of Gothenburg, Institute of Biomedicine",https://www.nature.com/naturecareers/job/12799150/postdoctoral-fellow-in-bioinformatics-and-antibiotic-resistance/?TrackID=12&utm_source=rss&utm_medium=feed&utm_campaign=general,0,0,0,0,0,0,1,0,0,0,0,0,0,0,0,0,925,9,13
34,Songshan Lake Materials Laboratory (SLAB): Distinguished Junior Fellowship,"China, Guangdong | Songshan Lake Materials Laboratory (SLAB) ","About us The South Bay Interdisciplinary Science Center (SBISC) is one of the four core divisions of the Songshan Lake Materials Laboratory (SLAB), situated in Dongguan, the Pearl River Delta. Centered around materials research, SBISC supports basic and applied research in matter and energy, life sciences, advanced manufacturing, and artificial intelligence. Through various in-house and collaborative programs, SBISC strives to become an academic leader in cutting-edge interdisciplinary research. SBISC is currently conducting an international talent search under its Distinguished Junior Fellowship Program. We look for young scientists with a PhD degree in relevant fields to carry out independent and original research at the Center. The Fellowship offers a CNY 600,000 annual salary, housing, and expenses related to academic exchange and activities. The funding duration is 3 years but is extendable to 5 years based upon performance review and mutual agreement. How to apply Interested applicants should submit a cover letter , resume and three letters of recommendation , along with a detailed research plan for the next 3 years . Collaboration with in-house and visiting scientists at SBISC/SLAB is encouraged but not required. For research that requires lab facilities and equipment, a separate resource requirement plan should accompany the application. Available SLAB platform resources can be found at http://www.sslab.org.cn/core/platform . Applications and inquiries should be directed to hr@sslab.org.cn. SLAB has additional full-time openings in all ranks with generous compensations and startup funds in all areas of materials research. Interested applicants are encouraged to explore listings at http://slab.hotjob.cn/ .",2023-05-29 10:00:14,2023-08-16 22:59:00,,"China, Guangdong",Songshan Lake Materials Laboratory (SLAB),https://www.nature.com/naturecareers/job/780921/distinguished-junior-fellowship/?TrackID=12&utm_source=rss&utm_medium=feed&utm_campaign=general,0,0,0,0,0,0,0,0,0,1,0,0,0,0,0,0,248,8,8
35,Centre for Oncology and Immunology: Postdoctoral Fellow - The Laboratory of Prof. Naoto Hirano ,"China, Hong Kong | Centre for Oncology and Immunology ","The long-term objective of the Centre for Oncology and Immunology is to identify druggable cancer targets of recalcitrant malignancies and developing therapeutics leading to clinical trials and commercialization. Aspects of our work include executing novel functional screens, developing animal and cell models including organoids, developing novel approaches to immuno-oncology, and performing advanced genomic and proteomic techniques at single cell resolution. Success in this venture will address pressing unmet medical needs and establish Hong Kong as a leading hub of innovative anti-cancer and immuno-oncology drug development. The position will focus on developing novel immunotherapeutics under the direction of Prof. Naoto Hirano as part of a collaborative program between the University of Hong Kong and the University Health Network/Princess Margaret Cancer Centre (Canada). The successful candidate will work in close collaboration with the principal investigator’s scientific teams at the Centre of Oncology and Immunology and the Princess Margaret Cancer Centre to perform translational research in cancer immunotherapy. Job responsibilities: Applicants are expected to contribute to collaborative research projects in cell-based immuno-oncology drug development. Qualifications and skills: Applicants should have strong research background in biomedical sciences, bioengineering and biological science, preferably in cancer biology, immunology, immuno-oncology, molecular biology, genomic, proteomic, or metabolomic. We are seeking enthusiast applicants in possession of the following: Essential Possess a proven track record of publishing academic research papers Understanding and/or experience in immuno-bioengineering Experienced in molecular biology and cellular immunology laboratory techniques, including handling mammalian cell culture Desirable Specialised research interest in structural biology Understanding and experience in development of ‘muteins’ Experienced in humanized mouse models Experienced in animal handling techniques Experienced in clinical trial theory and practice and establishing translational research processes and infrastructures Applicants should have a good command of written and spoken English, strong communication skills, and be self-motivated, hardworking and able to work well in an interdisciplinary team. The appointees shall work in Hong Kong Science and Technology Park. Overseas graduates are welcome to apply; the qualification awarding institution should be ranked in the top 100 institutions for STEM-related subjects in QS/Shanghai Jiao Tong Uni/Times Higher Education/U.S. News world university rankings. Applicants for the Postdoctoral Fellow posts should possess a Ph.D. degree or an equivalent qualification in one of the said or related disciplines. (H03/2023/B1/UHN) A highly competitive salary commensurate with qualifications and experience will be offered, in addition to annual leave and medical benefits. How to apply: Applicants should submit a C.V. and research publication list, quoting the job reference number, with information of current/expected remuneration and availability, to career@coinno.hk. Review of applications will commence as soon as possible or until the posts are filled. The personal data provided in your application process will be used for recruitment and other employment-related purposes. The personal data may be transferred and disclosed to, and used by, HKU Innovation Holdings Limited and The University of Hong Kong for the above mentioned purposes. We are an equal opportunities employer and welcome applications from all qualified candidates.",2023-06-01 18:28:02,2023-07-31 22:59:00,,"China, Hong Kong",Centre for Oncology and Immunology,https://www.nature.com/naturecareers/job/12799997/postdoctoral-fellow-the-laboratory-of-prof-naoto-hirano-/?TrackID=12&utm_source=rss&utm_medium=feed&utm_campaign=general,0,0,0,0,0,0,0,0,0,0,1,0,0,0,0,0,489,9,14
