41,Shandong Agricultural University: Recruitment of Dezhou (Qihe) Wheat Industry Research Institute of Shandong Agricultural University ,"China, Dezhou | Shandong Agricultural University ","Recruitment of Outstanding Talents in the Field of Wheat Research at Home and Abroad by the Institute for Dezhou (Qihe) Wheat Industry Research of Shandong Agricultural University Shandong Agricultural University (SDAU), located at the foot of the magnificent Mount Tai, is a multi-disciplinary university with agricultural science as its strength and life science as a distinctive feature, covering many areas of both natural sciences and social sciences. SDAU currently has 1 national key laboratory, 3 national engineering research centers, 2 national engineering technology research centers, and 1 national technology innovation center. SDAU ranks top 200 in QS World University Rankings in the subject of agriculture and forestry. 6 disciplinary categories of SDAU rank top 1% in ESI, among which Plant and Animal Science ranks top 1‰. The University has 12 postdoctoral research stations including crop science, plant protection, and biology. SDAU has strong research strength in the field of wheat research, and has achieved great accomplishments. It won the first prize of State Technological Invention Award. Researchers from SDAU have cloned genes with important breeding value including wheat head blight resistance gene Fhb7, published a series of scientific papers on internationally renowned journals such as Science, Nature Communications, etc. Several breakthrough new wheat cultivars such as Shannong 20 were bred here, with which winter wheat yield records in China have been broken many times. A number of advanced high-efficiency cultivation technologies were also developed at SDAU. All of these make SDAU lead the development of wheat cultivation in China. Located in the northwest of Shandong Province, Dezhou is an important wheat-producing region in China. The average yield per unit area in Dezhou ranks among the top in China. Dezhou has a vast field of wheat high-yield and multi-resistant variety screening demonstration area and a breeding base for improved varieties, which unifies seed supply, deep plowing, sowing, fertilization, pest and weed control, and management modes. Information technologies such as big data and the Internet of Things have been employed to achieve precise operation during wheat production. Besides, the grain production has been fully mechanized at Dezhou. Qihe is located in the southern tip of Dezhou, adjacent to the provincial capital Jinan. It is a super grain-producing county in China, which has the largest green and high-quality grain demonstration area of 800,000 mu in China. It has explored the ""Qihe Model"" of green food, high efficiency, product safety and resource saving. The Institute for Dezhou (Qihe) Wheat Industry Research of Shandong Agricultural University was jointly established by Shandong Agricultural University and Dezhou Municipal People's Government. Relying on the National Key Laboratory of Wheat Improvement, this institute brings together top scientists and superior teams at home and abroad in the field of wheat industry. Focusing on the key scientific questions and industrial technical problems in the field of wheat, the institute aims to achieve a number of original findings, develop breakthrough new wheat varieties, and green and efficient production and processing technology, thus facilitating the development of wheat industry. We warmly welcome outstanding talents at home and abroad to join us to seek development and create brilliance together! 1. Research areas (1) Major gene discovery and germplasm innovation in wheat (2) Innovation of wheat breeding technology (3) Breeding of major wheat varieties (4) Green, high-quality, high-yield and efficient wheat production (5) Key technology in the production of high-quality wheat seeds (6) Wheat intensive processing and functional food research and development (7) Research on development strategy of wheat industry 2. Positions and Benefits Level 1: Distinguished Scientists Requirements Candidates should have made numerous and sustained contributions in the field of wheat research. They should have world-class research level and internationally recognized major achievements. Candidates are expected to guide their research team toward cutting-edge research with an international impact. Benefit package Competitive benefit plans will be made individually according to each candidate’s status; annual salary: 1-2 million CNY; start-up fund: 10-20 million CNY; settling-in allowance: 2-3 million CNY. Level 2: Talents Requirements Candidates are expected to be excellent young and middle-aged talents at home and abroad who are engaged in frontier research in wheat related fields, and have a good working foundation and high academic attainments and internationally-recognized contributions and the great development potential. The age limit for this position is 40, but negotiable for extraordinary candidates. Benefit package Annual salary: 0.5-0.8 million CNY with dynamic increase according to your professional development; start-up fund: 1-2 million CNY; settling-in allowance: 1-1.5 million CNY. Successful candidates will be appointed as Professor, PhD supervisor and receive priority support on working space, infrastructure and facility, and enrollment of postgraduates. The Institute will provide fully furnished apartment, access to national health care program, assistance in family members’ employment and children’s enrollment in kindergarten and primary/high school to the successful candidates. Level 3: Full Time Postdoctoral Fellows Requirements Candidates should possess a Ph.D. degree on wheat related research, with good health and excellent academic performance, without violation record on academic misconduct or dishonesty. Candidates should possess solid professional knowledge and strong research skills, and the potential to make great contributions in related fields. Positions (1) Taishan young researchers: For doctors with outstanding achievements and great potential. Annual salary 400,000-500,000 CNY. (2) Funded postdoctoral fellows: For doctors with outstanding research ability and high potential. Annual salary 300,000-400,000 CNY. (3) General postdoctoral fellows: Appointment will be made with group leaders responsible for key research projects. Annual salary ≥ 250,000 CNY. Benefit package (1) Successful applicants for “Postdoctoral Innovation Talent Support Program”, “Shandong Postdoctoral Innovation Talent Support Program”, and other postdoctoral support programs, will receive additive compensation of up to 2.3 million. (2) Successful candidates will join the expert team of the Institute for Wheat Industry Research, and conduct pioneering research. Adequate research funding and perfect research conditions will be offered. (3) During the employment period, successful candidates will enjoy the benefits of staff, Social Security, Healthcare Security and Housing Provident Fund. (4) The Institute will provide fully furnished young talent apartment, and children’s enrollment in kindergarten and primary/high school to candidates who work at Dezhou. (5) Successful candidates are eligible to participate in the evaluation of professional titles according to the policy of SDAU to obtain the corresponding certifications. (6) For those who are exceptionally outstanding in the outbound examination, priority will be given when they apply for faculty positions according to the hiring policy of SDAU. Subsidies from various government-sponsored talent programs of Dezhou government will also be made available for eligible candidates. 3. Application Procedure (1) All candidates are required to send the materials specified as below to rsc@sdau.edu.cn titled with “application for –position + your name”, including a detailed resume and supporting materials provided in one PDF file including degree certificates, representative scientific research achievements, etc. (2) Formal review of the application materials from the candidates. (3) In accordance with the principles of openness, fairness, impartiality and merit-based admission, experts are organized to conduct interviews and determine the recruits. (4) Filing procedures. 4. Application Deadline This announcement will come into effect on the date of announcement. We accept applications all year round. 5. Contact The Institute for Dezhou (Qihe) Wheat Industry Research of Shandong Agricultural University Contact person: Mr. Shen, Mr. Gao Phone: 86-538-8249858, 86-538-8242479 E-mail: rsc@sdau.edu.cn Address: Daizong Road No.61, Tai’an, Shandong, China",2023-06-01 18:28:08,2023-07-29 22:59:00,,"China, Dezhou",Shandong Agricultural University,https://www.nature.com/naturecareers/job/12799885/recruitment-of-dezhou-qihe-wheat-industry-research-institute-of-shandong-agricultural-university-/?TrackID=12&utm_source=rss&utm_medium=feed&utm_campaign=general,0,0,0,0,0,0,0,0,0,1,0,0,0,0,0,0,1204,6,15
42,"Center for Evolutionary & Organismal Biology, Zhejiang University: Principle Investigator and Joint Recruitment Position-Postdoc ","China, Hangzhou | Center for Evolutionary & Organismal Biology, Zhejiang University ","Principle Investigator The Center for Evolutionary & Organismal Biology at Zhejiang University in Hangzhou, China, invites applications from evolutionary scientists for All ranks, Assistant or Associate, Full-Professor. Applications from both Chinese and non-Chinese nationals are all welcomed and will be evaluated on experience and qualifications on an equal opportunity basis. Successful candidates must hold a Ph.D., M.D., or equivalent degree and have demonstrated the potential to establish a vibrant independent research program. The CEOB is a brand-new institute in China with a research focus on evolution. The center is hosted by the School of Medicine and receives strong support from the university and Zhejiang Province. The research disciplines in the center include but are not limited to, evolutionary developmental biology, evolutionary genomics, evolutionary medicine, experimental evolution, bioinformatics, and population genetics. Each faculty member will receive an internationally competitive salary and start-up package that includes long-term and sufficient research funds, ample laboratory space, excellent equipment, and research support. The center already hosts several PIs in the fields of evolutionary genomics, computational biology, and evolutionary developmental biology. We offer State-of-the-art research space; A workplace that values diversity and promotes junior researchers; A young and internationally recognized, vibrant, and collaborative research environment; Highly-motivated student pool; The cutting-edge genomic and molecular biology facilities; International collaboration network. Qualifications: A very good doctorate (Ph.D/M.D) in the relevant research areas; A visible publication track record reflecting your scientific excellence and research focus; A convincing research concept and plan; A team player mentality, good communication skills, and the ability to successfully lead diverse international teams. Responsibilities: Building an innovative team; Personal advancement skills to secure external funding; Enthusiasm in teaching and nursing the next generation of evolutionary biologists; Engagement in the academic self-administration of the center; Establishing cross-disciplinaries research programs in collaboration with researchers from other fields. Application Instructions: Letter of motivation with a clear statement of why the center as a research location is interesting for you & where your career should take you; Curriculum vitae; -List of publications; -Copies of the certificates; Research concept including graphical abstract (max. 2 pages); References (max. 3). Deadline: October 31st, 2023 Contact: Prof. Guojie Zhang guojiezhang@zju.edu.cn Joint Recruitment Position: Postdoc (at least 460,000 RMB per year) Center for Evolutionary & Organismal Biology at Zhejiang University and Alibaba. Requirements: 1. A Ph.D. in fields related to data science, artificial intelligence, deep learning, bioinformatics, and genomics (in no particular order) is required. 2. Familiar with machine learning models, such as deep learning, neural network algorithms, etc., with the ability to develop related models. Candidates with a background in genomics are preferred. 3. Have published papers as first author or co-first author in international journals, with independent thinking ability, and be able to explore new methods and technologies. 4. Excellent academic background and innovative research ideas in this field, with a solid professional foundation. 5. Have a long-term commitment to scientific research and possess a sense of responsibility and teamwork. 6. Have good communication and writing skill in English. Responsibilities: The position involves using machine learning algorithms to carry out genomic data mining and developing new genomic analysis algorithms. The candidate will integrate machine learning methods with large-scale genomic data to build the link between genotype and phenotype. There will be many research topics to choose from. The topic will be jointly guided by Professor Guojie Zhang's team at the Center for Evolutionary & Organismal Biology at Zhejiang University and Dr. Jieping Ye's team at Alibaba. These two teams have already carried out cutting-edge research in genomics, collected large amounts of data, and developed new models for genomic data mining. We look forward to your joining us. Benefits: 1. Competitive salary will be offered (annual salary of 460,000-520,000 RMB per year, negotiable). 2. The relevant benefits of Zhejiang University while working closely with the Alibaba research team. 3. International and multidisciplinary research environment. 4. Be able to organize and conduct cutting-edge research in genomics and participate in Major and International Cooperative research programs. 5. We will offer open research environment and the opportunity to explore your long-term personal career development. 6. According to the relevant regulations of the university, you can apply for on-campus housing. 7. Fully support the recruits apply the fundings from University and the National Natural Science Foundation of China. 8. Other benefits will be provided preferentially according to the qualifications of the candidates. Contact: Email: heyunqiu@zju.edu.cn Tel: 0571 8820 8707",2023-06-01 18:28:09,2024-01-29 23:59:00,,"China, Hangzhou","Center for Evolutionary & Organismal Biology, Zhejiang University",https://www.nature.com/naturecareers/job/12799900/principle-investigator-and-joint-recruitment-position-postdoc-/?TrackID=12&utm_source=rss&utm_medium=feed&utm_campaign=general,0,0,0,0,0,0,0,0,1,0,0,0,0,0,0,0,731,11,14
43,National Institutes of Health: Staff  Scientist Position for a Computational Biologist ,"United States, Bethesda | National Institutes of Health ","Dr. Warren Leonard’s laboratory, the Laboratory of Molecular Immunology (LMI) and the Immunology Center, National Heart, Lung, and Blood Institute (NHLBI), National Institutes of Health (NIH), seeks to hire a creative and motivated Computational Biology Staff Scientist with expertise related to epigenomics, genomics, biostatistics, and systems biology approaches to join an interactive exciting group. Our laboratory focuses on molecular immunology particularly related to cytokines that control critical immune processes related to human disease. We use ChIP-Seq, RNA-Seq, ATAC-Seq, Hi-ChIP, at both bulk and single-cell level, and a range of other sequencing approaches to analyze genome-wide distribution of chromatin modifications and DNA-binding factors, global gene expression, as well as whole exome and whole genome analysis. Candidates should hold a Ph.D. degree or equivalent with at least 3 years of post-doctoral experience but please express interest even if more junior with outstanding qualifications. Candidates should have an excellent track record of productivity judged by peer reviewed publications, with experience in Bioinformatics, Computer Science, or Statistics, and knowledge of R, Python, and C or C++. The successful applicant will have the opportunity to pursue research interests in an interdisciplinary setting and advance their research career in the supportive intramural environment of the NIH campus. A competitive salary commensurate with experience and qualifications will be offered. Appointees must be U.S. citizens, resident non-citizens, or nonresident non-citizens with a valid employment visa. Applications from women, minorities and persons with disabilities are strongly encouraged. Applicants should send their curriculum vitae, brief statement of research interests/career goals, and provide 3 letters of reference to: Warren J. Leonard, M.D. Chief, Laboratory of Molecular Immunology and Director, Immunology Center Building 10, Room 7B05 10 Center Drive, Bethesda, MD 20892-1674, USA Email: leonardw@nhlbi.nih.gov HHS and NIH are Equal Opportunity Employers The NIH is dedicated to building a diverse community in its training and employment programs.",2023-06-01 18:28:10,2023-07-31 22:59:00,,"United States, Bethesda",National Institutes of Health,https://www.nature.com/naturecareers/job/12800007/staff-scientist-position-for-a-computational-biologist-/?TrackID=12&utm_source=rss&utm_medium=feed&utm_campaign=general,0,0,0,0,0,0,0,0,0,1,0,0,0,0,0,0,305,8,11
44,Institute of Biomedical Engineering:  Assistant/Associate Professor,"Taiwan, Taiwan | Institute of Biomedical Engineering ","The Institute of Biomedical Engineering, National Tsing Hua University, seeks highly qualified individuals for 1 position in the assistant or associate professorship levels. The candidate must have a Ph.D. degree in engineering or science, an outstanding record of accomplishments in research ( nanobiodetection , biomaterials and biomedicine ) and enthusiasm in teaching. Application portfolio including curriculum vitae, copies of diplomas, copies of undergraduate and graduate transcripts, full publication list, teaching and research plans, contact information (names, mailing addresses, emails, phone numbers) of three referees (only a list is needed upon submission) and the CV at-a-glance (available on http://my.nthu.edu.tw/~bme/index.html) should be sent to Ms. Peggy Sung at chsung@mx.nthu.edu.tw by August 11, 2023.",2023-06-01 18:28:11,2023-07-30 22:59:00,,"Taiwan, Taiwan",Institute of Biomedical Engineering,https://www.nature.com/naturecareers/job/12799943/-assistant-associate-professor/?TrackID=12&utm_source=rss&utm_medium=feed&utm_campaign=general,0,0,0,0,0,0,0,0,0,1,0,0,0,0,0,0,111,7,6
45,Songshan Lake Materials Laboratory (SLAB): Global Recruitment for Principal Investigator in Songshan Lake Materials Laboratory,"China, Guangdong | Songshan Lake Materials Laboratory (SLAB) ","Welcome to join SLAB! Located in Dongguan, one of the main cities in the Guangdong-Hong Kong-Macao Greater Bay Area, Songshan Lake Materials Laboratory (SLAB) started construction on December 22, 2017, and completed registration in April 2018. As one of the first Guangdong provincial laboratories, SLAB consists of four core sections: the Frontier Research Center, the Public Technology Platform and Large-scale Scientific Facilities, the Model Factory for Innovation, and the South Bay Interdisciplinary Science Center. It is expected to become an internationally recognized southern base for new materials research and development, an important component of China’s materials research, and a new window of interdisciplinary cooperation in the Guangdong-Hong Kong-Macao Greater Bay Area. Vacancies Full Professors in, but not limited to, the following directions: Superconducting materials Advanced semiconductor materials Information materials Biomedical materials Metallic materials Ceramic materials High polymer materials Energy materials Ultrafast laser technology Attosecond science Requirements for Full Professors 1. Ph.D. degree from a well-known overseas university, with over two years overseas research experience; Or Ph.D. degree from a domestic university, with overseas postdoctoral research experience; Or over three years’ overseas or domestic research experience, and have obtained faculty positions from a well-known overseas or domestic university or research institute; Or used to hold a senior technical position or serve as the chief technical consultant of a well-known R&D company. 2. Preferably under 40 years old (calculated as of December 31st of the application year) and should be able to report to work within six months after being offered the position. 3. Papers published in internationally recognized journals or academic conferences, strong academic research ability or potential, or with advanced domestic and foreign intellectual property rights and invention patents. 4. Please provide a detailed resume, relevant research summary, and research plan with budget plans, letters of recommendation from two referrers and their contact information. Benefits 1. Internationally competitive salary. Full Professors: an annual salary of RMB 750,000+; Top talents: negotiable. 2. Sufficient team support. Group leaders can enjoy start-up funding of RMB 10,000,000 and a quota for postdoctoral and postgraduates. 3. Competitive government subsidies. Those recognized as high-level talents of Dongguan City can enjoy a housing allowance of RMB 1,000,000 to RMB 10,000,000; Qualified overseas high-level talents and urgently-needed talents can enjoy local income tax deduction policy. 4. High standard social insurance and housing funds, well-furnished apartments to rent, and children to be enrolled into good schools. For more information about our job vacancies, please visit http://slab.hotjob.cn/ Application materials 1. Resume; 2. Cover letter or personal statement; 3. Research/work summary and plan; the research plan should indicate the budget. 4. Name, contact information and recommendation letters of two referees in the same professional field. 5. Attached materials: copy of passport (ID card), proof of employment; copy of highest academic degree diploma, professional and technical certificate; lists of published academic works (indicating the first author and corresponding author), awards; copies of patent certificates and documents certifying the transformation of the achievements, as well as other relevant materials that are deemed necessary. Website： http://www.sslab.org.cn/ E-mail：gaocengci@sslab.org.cn Contact Number 86-769-89136718 Address： Building A1, International Innovation Entrepreneurship Community, Songshan Lake, Dongguan City, Guangdong Province, China SLAB Invites Talented Applicants!",2023-06-01 18:28:13,2023-07-31 22:59:00,,"China, Guangdong",Songshan Lake Materials Laboratory (SLAB),https://www.nature.com/naturecareers/job/780334/global-recruitment-for-principal-investigator-in-songshan-lake-materials-laboratory/?TrackID=12&utm_source=rss&utm_medium=feed&utm_campaign=general,0,0,0,0,0,0,0,0,0,1,0,0,0,0,0,0,524,8,15
46,NIH National Cancer Institute (NCI): NIH Cancer Postdoc Fellowships Available!,"United States, Bethesda | NIH National Cancer Institute (NCI) ","Want to train with world-renowned cancer researchers at NIH? Consider joining the Center for Cancer Research (CCR) at the National Cancer Institute for your postdoctoral fellowship! At CCR, we focus on high-risk, cutting-edge science, pursuing the most important — and most difficult — problems in the field. You’ll have opportunities to: Collaborate with and learn from with highly specialized experts Train on and use world-class technology Conduct research at the NIH Clinical Center, the world’s largest dedicated research hospital Contribute to treatment development with bench-to-bedside research With a commitment to training the next generation of scientists, we'll help you launch your career in basic, translational or clinical research. CCR fellows enjoy: Independent research projects Competitive stable stipends Career and professional development resources Travel awards Generous benefits Resources for a healthy work/life balance We are creating the cancer medicines of tomorrow. To see open positions, go to https://bit.ly/3ov0F1N Or follow this link to subscribe to our careers bulletin: http://bit.ly/40jMb2U Positions are typically funded for up to 5 years with an annual starting stipend for new postdocs of $62,600. Ph.D., M.D. or equivalent required. Eligibility requirements may vary by position. Applicants may be a U.S. Citizen or permanent resident or enter through the visiting program with sponsored visa and must have no more than 5 years of postdoctoral experience. NCI is an equal opportunity employer. The NCI and CCR are deeply committed to diversity of thought, equity and inclusion and encourage applications from groups underrepresented in STEM careers including women, Blacks or African Americans, Hispanics or Latinos, American Indians or Alaska Natives, Native Hawaiians and other Pacific Islanders and individuals with disabilities.",2023-06-01 18:28:14,2023-07-29 22:59:00,,"United States, Bethesda",NIH National Cancer Institute (NCI),https://www.nature.com/naturecareers/job/12799921/nih-cancer-postdoc-fellowships-available-/?TrackID=12&utm_source=rss&utm_medium=feed&utm_campaign=general,0,0,0,1,0,0,0,0,0,0,0,0,0,0,0,0,270,9,10
