18,Novo Nordisk: Principal Scientist - Oral Biologics,"United States, Lexington | Novo Nordisk ","About the Department As part of the establishment of our R&D Hub in greater Boston, Novo Nordisk is growing its efforts within advanced drug delivery. A cornerstone of this is an expansion of our efforts in advancing oral biologics-based treatments to address unmet needs within a broad range of serious chronic diseases. Building on our success in developing the world’s first GLP-1 peptide in a tablet, we are rapidly growing our activities in our relentless pursuit of the next generation of oral-based therapies across a range of new modalities. You will join and help build a vibrant and science-focused team of scientists, where innovation is at the core. One of the core focuses of the hub is to drive early-stage innovation within oral drug delivery sciences with a focus on new modalities such as peptides, proteins and oligonucleotides. In growing our presence in the greater Boston area via our R&D Hub, we seek to bring together the 100-year heritage and experience of Novo Nordisk with the unparalleled innovation eco-system found in Boston. We will be based in new, purpose-built lab facilities in Lexington and co-located with our Dicerna Transformational Research Unit (TRU). As part of a team of leading scientists and innovators, you will bring your own ideas and collaborate with others to develop the next generation of oral biologics. It’s ground-breaking work with the promise of improving the lives of millions of people with chronic conditions. If you want to make a difference, join us to do pioneering research that can impact people everywhere. The Position The Principal Scientist will provide scientific leadership in the identification and development of novel advanced drug delivery systems to achieve oral administration of biologics including peptides and proteins. This will be achieved by functioning as a subject matter expert that provides strategic guidance to project teams, evaluates emerging technologies, and proposes and oversees external collaborations and strategic partnerships. The Principal Scientist may mentor senior colleagues in formulation and drug delivery sciences and will represent the organization to the external scientific community through publication and presentation of highly impactful research. Relationships Internal relationships include project teams and research colleagues both in Denmark, Boston, and around the globe. It is crucial that the holder of the role will have daily proactive collaboration with colleagues in the team, together with close colleagues based in Denmark. Communicates data externally when required. May oversee parts of oral formulations operations and laboratory facilities. Individual Contributor: does not manage other employees or contingent workers. Essential Functions Advances research projects by demonstrating technical mastery, creativity, and scientific leadership in oral drug delivery, and broad knowledge of related disciplines including a strong understanding of the pharmaceutical industry. Analyzes highly complex data with high degree of sophistication, connecting disparate datasets to reach conclusions and set direction on experiments. Effectively communicates and collaborates across global sites and sets project strategy by providing leadership of cross-functional project teams. Represents the organization through external communication of impactful scientific research in the form of presentation at external conferences and publication in scientific journals and patents. Proposes and oversees external collaborations. Maintains a deep understanding of theoretical knowledge and a connection to the external scientific community through continuous evaluation of relevant literature. Expands the capabilities of oral drug delivery sciences through the generation of new ideas, evaluation of oral drug delivery methodologies, and implementation of technologies that add value. Leads global, cross-functional experimental teams to achieve project goals. Provides significant mentorship and training of senior colleagues. Contributes subject matter expertise to develop the research agenda with a clear understanding of the link between scientific project goals and overall long-term business needs. Proposes new projects that support the strategic agenda and address gaps in technological capabilities and therapeutic areas. Qualifications Bachelor’s degree required. Masters or PhD strongly preferred. Relevant Post-graduate/industry experience required PhD with 10 years relevant industry or post-doctorate experience OR Master's Degree with 16 years relevant industry or post-doctorate experience OR Bachelors with 22+ years’ relevant experience can be considered Relevant required experience includes: Working understanding and experience within oral drug delivery Excellent understanding of the physiology of the gastrointestinal tract Experience of formulation-related processes (including, but not limited to, tableting, spray-drying, solid state characterisation) Demonstrated evidence (publications, patents etc., ) of innovation within novel drug delivery systems Experience with developing and optimising novel in vitro and in vivo models for testing of formulations/drug delivery systems Track-record of leading multi-disciplinary teams within complex projects Business understanding and cross-functional stakeholder management skills T Track record in setting scientific direction and driving projects along the value chain First-hand experience with driving external innovation (e.g., academic collaborations, strategic partnerships etc.,) Preferred experience includes: Experience with working with new modalities (e.g., peptides, proteins, oligonucelotides etc.,) Knowledge of active transport mechanisms for delivery across the gastrointestinal tract Insights into nanoparticles or other nano/micro-sized drug delivery systems Experience with a global organization and interculturally competent The ability to acquire new knowledge quickly and with little direction/oversite Good business understanding across the R&D value chain Demonstrates excellent verbal and written communication skills We commit to an inclusive recruitment process and equality of opportunity for all our job applicants. At Novo Nordisk we recognize that it is no longer good enough to aspire to be the best company in the world. We need to aspire to be the best company for the world and we know that this is only possible with talented employees with diverse perspectives, backgrounds and cultures. We are therefore committed to creating an inclusive culture that celebrates the diversity of our employees, the patients we serve and communities we operate in. Together, we’re life changing. Novo Nordisk is an equal opportunity employer. Qualified applicants will receive consideration for employment without regard to race, ethnicity, color, religion, sex, gender identity, sexual orientation, national origin, disability, protected veteran status or any other characteristic protected by local, state or federal laws, rules or regulations. Novo Nordisk requires all new hires to be fully vaccinated against COVID-19 prior to the first date of employment. As required by applicable law, Novo Nordisk will consider requests for reasonable accommodation. If you are interested in applying to Novo Nordisk and need special assistance or an accommodation to apply, please call us at 1-855-411-5290. This contact is for accommodation requests only and cannot be used to inquire about the status of applications.",2023-05-29 09:59:59,2023-06-03 22:59:00,,"United States, Lexington",Novo Nordisk,https://www.nature.com/naturecareers/job/12797379/principal-scientist-oral-biologics/?TrackID=12&utm_source=rss&utm_medium=feed&utm_campaign=general,0,0,0,0,0,0,0,0,0,1,0,0,0,0,0,0,1053,6,7
19,"Umeå Plant Science Centre, Swedish University of Agricultural Sciences: Postdoctoral scholarship, 2 years, in plant developmental biology","Sweden, Umeå | Ume&#229; Plant Science Centre, Swedish University of Agricultural Sciences ","We are looking for a highly motivated postdoctoral fellow for the Kempe Foundations funded project ""Analysis of miRNA function during embryo development in Norway spruce"". The postdoctoral fellowship will be placed at the Department of Forest Genetics and Plant Physiology ( Swedish University of Agricultural Sciences ), which is part of Umeå Plant Science Centre . The fellowship is at full-time for two (2) years, starting 1 September 2023. Project summary The project aims at understanding the function of miRNAs during embryo development in the model gymnosperm species Norway spruce (Picea abies). Gene expression RNA-Seq data and expression data for miRNA from the corresponding samples from a developmental series of zygotic embryos, the associated gametophytic tissue and somatic embryos are available from a previous project. Preliminary processing of the data suggests that miRNA may be involved in the regulation of key developmental steps during embryogenesis. Specifically, the expression data will be further analyzed to identify candidate genes and potentially associated miRNA and functional studies performed to test the hypothesis. An increased understanding of the regulation of embryo development in Norway spruce will generally support improvements of protocols for somatic embryogenesis-based propagation of commercially important conifers. Work tasks The suitable candidate will primarily work with bioinformatic analyses to select candidate miRNA and associated targets. Qualifications A strong documented background in plant developmental biology is required. Specific knowledge in regulation of embryo development is desirable. Fluent in written and spoken English. Bioinformatics expertise is essential. This includes familiarity with processing, aligning, and analyzing Illumina RNA-Seq and shortRNA-Seq data, expression normalization and quantification, differential expression analysis (preferably using DESeq2) and visualization of results. Familiarity with miRNA analysis, including identification of known and prediction of novel miRNAs, is highly desirable. Familiarity with Linux, command line / shell scripting and relevant tools is essential. Experience in use of job scheduling and HPC infrastructure is highly desirable. Experience in use of tools for reproducibility, for example, containers and git, are beneficial. The position will involve extensive work in R and/or Python in addition to running command line tools and constructing analysis pipelines. As such, experience with tools such as Snakemake or Nextflow would be beneficial. Knowledge of biostatistics is required. Required degree: PhD in a relevant area. Application The application should contain: CV with full publications and copiers of the relevant degree certificates, description of research experiences, a statement of scientific interests, contact information of three references. Please send the complete application to Dr. Ulrika Egertsdotter ( Ulrika.Egertsdotter@slu.se ). Applications are accepted until the position is filled. Position specifications The position is located at Umeå Plant Science Center in the laboratory of Dr. Egertsdotter. The postdoc position is supported by a stipend for a 24-month period starting September 1st, 2023. Contact For questions, please contact Ulrika.Egertsdotter@slu.se . About the Research Environment The Department of Forest Genetics and Plant Physiology is part of Umeå Plant Science Centre (UPSC) which is a centre of excellence for experimental plant research and forest biotechnology in Northern Sweden. Our mission is to perform excellent and innovative basic research and generate knowledge that benefits forestry, agriculture, environment and society. We work across a wide range of disciplines in plant science reaching from cell biology to ecophysiology and from basic research to industrial applications. Our common goal is to understand the plants’ ability to grow, adapt and acclimate to a changing world and how we can breed better plants. UPSC belongs to two universities, Swedish University of Agricultural Sciences (SLU) and Umeå University . About 200 people from more than 40 different nationalities work here. We host some 30 principal investigators, and our researchers have access to state-of-the-art analytical platforms, unique tree germplasm resources and plant growth facilities. We strive for a collaborative work environment and support our scientists throughout all career stages by providing professional training opportunities and individual career mentoring. Umeå has a strong postdoc community organised in the Umeå Postdoc Society (UPS). UPS fosters networking amongst postdocs, organises social and career development events and works towards improving the postdoc experience in Umeå. Check out their website: https://umeapostdocsociety.se/ and do not hesitate to get in contact with them! About SLU SLU is a world-class international university with research, education and environmental assessment within the sciences for sustainable life. Its principal sites are in Alnarp, Umeå and Uppsala, but activities are also conducted at research stations, experimental parks and educational establishments throughout Sweden. We bring together people who have different perspectives, but they all have one and the same goal: to create the best conditions for a sustainable, thriving and better world. SLU has just over 3,000 employees, 5,000 students and a turnover of SEK 3 billion. The university has invested heavily in a modern, attractive environment on its campuses. Read more about our benefits and what it is like to work at SLU at https://www.slu.se/en/about-slu/work-at-slu/ .",2023-05-29 10:00:00,2023-07-14 22:59:00,,"Sweden, Umeå","Ume&#229; Plant Science Centre, Swedish University of Agricultural Sciences",https://www.nature.com/naturecareers/job/12799314/postdoctoral-scholarship-2-years-in-plant-developmental-biology/?TrackID=12&utm_source=rss&utm_medium=feed&utm_campaign=general,0,0,0,0,1,0,0,0,0,0,0,0,0,0,0,0,805,12,17
20,"Fudan University: Faculty Positions in Multiscale Research Institute for Complex Systems, Fudan University","China, Shanghai | Fudan University ","The Multiscale Research Institute for Complex Systems (MRICS) at Fudan University is located at the Zhangjiang Campus of Fudan University and is supported by the Shanghai Government. MRICS is strongly committed to the development of novel and effective multi-scale biological imaging technology that spans microscopic molecular structures all the way to macroscopic medical imaging, with the ultimate goal to provide unprecedented spatial and temporal insights into the structures and functions of living beings at all levels (molecules, cells, tissues, organs and even whole organisms). Our team includes Nobel laureate Professor Michael Levitt and international leading interdisciplinary experts. MRICS seeks candidates for multiple faculty positions at all levels. All applicants must have a Ph.D. or M.D. degree. These faculty positions are open to biology-related fields including bioinformatics, genetics, cell biology, biochemistry, developmental biology, physiology, among others. The successful candidates must have demonstrated high-quality scholarship through publications in peer-reviewed journals, have a keen interest in highly original research and strong commitment to graduate education. We will provide competitive salary commensurate with qualifications and experience. We offer comprehensive benefits packages including health insurance as well as housing allowance. MRICS will also sponsor applications for national and local funding opportunities based on the individual’s qualification and experience. MRICS is located in Shanghai, China, which is an exciting and rapidly growing global center of excellence for scientific research. Interested applicants are invited to submit the application package to mrics_fd@fudan.edu.cn , which should include a cover letter, CV, a concise statement of research interests, and the names and email addresses of three higher-ranked professionals who can serve as referees . Review of applications will start immediately and continue until positions are filled.",2023-05-29 10:00:01,2023-09-12 22:59:00,,"China, Shanghai",Fudan University,https://www.nature.com/naturecareers/job/779264/faculty-positions-in-multiscale-research-institute-for-complex-systems-fudan-university/?TrackID=12&utm_source=rss&utm_medium=feed&utm_campaign=general,0,0,0,0,0,0,0,0,0,1,0,0,0,0,0,0,276,5,13
21,University of Adelaide: Bioinformatics Postdoctoral Researcher,"Australia, Adelaide | University of Adelaide ","Bioinformatics postdoctoral position: (Level A) $91,402 to $97,927 or (Level B) $102,952 to $121,779 per annum plus an employer contribution of 17% superannuation applies. 3 year fixed term full time postdoctoral opportunity available in the newly established Adelaide Centre for Epigenetics (ACE). One bioinformatic position available to work within Professor Jose Polo’s group in the recently established Adelaide Centre for Epigenetics (ACE). This opportunity is for high achieving postdoctoral researchers to join the recently relocated Polo group in a collaborative framework in the application and development of new computational methods for the analysis of single cell, spatial Omics, and epigenomics data. ACE is a newly established centre within the Faculty of Health and Medical Sciences focusing on epigenetic research and cell fate, which will include research in development, reprogramming and cancer. The Adelaide Centre for Epigenetics is associated with the recently established South Australian immunoGENomics Cancer Institute (SAiGENCI) which will be the state’s world class cancer research institute. To be successful at Level A, you will need: Completion of a PhD in biology, computational biology, applied mathematics, computer science, physics, biostatistics, statistics or bioinformatics or have equivalent qualifications or research experience Programming experience with bash, and R and/or python scripting languages. Experience in the analysis and integration of single cell NextGen sequencing data. Experience in the analysis and integration of bulk RNA-seq, ATAC-seq, ChIP-seq/ CUT&Tag-seq and DNA genome-wide methylation datasets. Evidence of strong contribution towards research relevant to the particular field of study/interest In addition to the above, to be successful at Level B, you will also need: Strong track record of high-quality publications and conference presentations relative to opportunity Techniques for reproducible research and version control, including but not limited to experience generating knitr reports, GitHub repositories, and R package development. Demonstrated ability to conduct independent research, including leading research, where applicable in cancer systems and/or developmental biology using high throughput genomics Demonstrated experience in the preparation of successful proposal submissions to external funding bodies. Demonstrated capacity to supervise students. Enjoy an outstanding career environment The University of Adelaide is a uniquely rewarding workplace. The size, breadth and quality of our education and research programs - including significant industry, government and community collaborations - offers you a vast scope and opportunity for a long, fulfilling career. It also enables us to attract high-calibre people in all facets of our operations, ensuring you will be surrounded by talented colleagues, many world-leading. Our work's cutting-edge nature - not just in your own area, but across virtually the full spectrum of human endeavour - provides a constant source of inspiration. Our culture is one that welcomes all and embraces diversity consistent with our Staff Values and Behaviour Framework and our Values of integrity, respect, collegiality, excellence and discovery. We firmly believe that our people are our most valuable asset, so we work to grow and diversify the skills, knowledge and capability of all our staff. We embrace flexibility as a key principle to allow our people to manage the changing demands of work, personal and family life. In addition, we offer a wide range of attractive staff benefits. These include: salary packaging; flexible work arrangements; high-quality professional development programs and activities; and an on-campus health clinic, gym and other fitness facilities. Learn more at: adelaide.edu.au/jobs Your faculty's broader role The Faculty of Health and Medical Sciences contains one of Australia's largest concentrations of leading health researchers, teachers and clinical titleholders. It's comprised of eight schools and a number of specialist disciplines, institutes and centres, variously focused on world-class research, and training the next generation of: medical doctors; surgeons; dentists; nurses; psychiatrists; psychologists; and other health professionals. Learn more at: health.adelaide.edu.au If you have the talent, we'll give you the opportunity. Together, let's make history. Click on the link below to be taken through to the online application form. https://careers.adelaide.edu.au/cw/en/job/511096/grantfunded-researcher Please ensure you submit a cover letter, resume, and upload a document that includes your responses to all of the selection criteria for the position as contained in the position description or selection criteria document. Applications close 11:55pm, 25th June 2022. The University reserves the right to close this advertisement before the closing date if a suitable candidate is identified. For further information For a confidential discussion regarding this position, contact: Professor Jose Polo Director Adelaide Centre for Epigenetics, School of Biomedicine/SAiGENCI E: jose.polo@adelaide.edu.au You'll find a full position description and/or selection criteria below: (If no links appear, try viewing on another device) The University of Adelaide is an Equal Employment Opportunity employer. Women and Aboriginal and Torres Strait Islander people who meet the requirements of this position are strongly encouraged to apply.",2023-05-29 10:00:02,2023-07-25 22:59:00,,"Australia, Adelaide",University of Adelaide,https://www.nature.com/naturecareers/job/12799819/bioinformatics-postdoctoral-researcher/?TrackID=12&utm_source=rss&utm_medium=feed&utm_campaign=general,0,0,0,0,0,0,1,0,0,0,0,0,0,0,0,0,770,6,6
